{"bounds":{"jurisdiction":"test-fixture-not-external-authority","scope":"submitted-example-only","valid_from":1789461990,"valid_until":1789465690},"buyer_key":"MCowBQYDK2VwAyEAXkRqPS6RIRgwUvyqnGWL7unovfAvuSbi5gt07wUvKbU=","client_reference":"test-8b9be6cf70a2e91479d88f5a5b597e49","nodes":[{"payload":{"content":{"count":3,"statement":"Three items are present in this submitted fixture."},"epistemic_status":"REPORT","id":"sample-observation","jurisdiction":"test-fixture-not-external-authority","locator":"urn:whp:test:source-1","operations":["INFORM","RECOMMEND"],"prior_hash":null,"qualifiers":["Only this submitted fixture.","No external-world truth claim."],"scope":"submitted-example-only","status":"ACTIVE","unknowns":[{"blocks":["EXECUTE"],"description":"No outside-world evidence is supplied.","id":"external-validity"}],"valid_from":1789461590,"valid_until":1789469290,"version":"1"},"protected":{"algorithm":"Ed25519","canonicalization":"WHP-JCS-I1","key_id":"f9e9603c7c6ce319b96a94eb6bcaecfd0394ea7daac87cc187474657219f5004","type":"WHP-SOURCE-ATTESTATION-v1"},"signature":"jjoYSeo6v93CBuM9W/3+3lRCmc2EjUYtLIMQ1hpJIJpLd7oVLfs3OxLAAwJkT4Z4t4YSI70cl0tBczJ0SoEkDg=="},{"payload":{"content":{"count":3,"statement":"Three items are present in this submitted fixture."},"epistemic_status":"REPORT","id":"preserved-representation","jurisdiction":"test-fixture-not-external-authority","locator":"urn:whp:test:representation-1","operations":["INFORM","RECOMMEND"],"prior_hash":null,"qualifiers":["Only this submitted fixture.","No external-world truth claim."],"scope":"submitted-example-only","status":"ACTIVE","unknowns":[{"blocks":["EXECUTE"],"description":"No outside-world evidence is supplied.","id":"external-validity"}],"valid_from":1789461590,"valid_until":1789469290,"version":"1"},"protected":{"algorithm":"Ed25519","canonicalization":"WHP-JCS-I1","key_id":"f9e9603c7c6ce319b96a94eb6bcaecfd0394ea7daac87cc187474657219f5004","type":"WHP-SOURCE-ATTESTATION-v1"},"signature":"LIPZ4+t3gmwzCYCxu17AO1F2CvYKWwYa7zG/kCiEYmXpLhdTthZdSKgs64s/fugOXWdfE9+6cP/86bcFnyDkAA=="}],"object":{"id":"preserved-representation","root":"9f76fe2e3ccc2260d7f3432678f3666137f55312bfbbc8d1e55ecb0b72c0401b","version":"1"},"profile":{"id":"WHP-STANDING-STRUCTURED-PASSAGE","sha256":"4244be9ed0012eaeba8e2efeb9d274ad3c1f3e188748838c191129054d24c5ab","version":"1.0.0"},"requested_operation":"INFORM","transitions":[{"payload":{"from":["67677c7a07e0c626a20cf9e891f1f64494c71ca0fc771a729e9cc26bebe8a41d"],"jurisdiction":"test-fixture-not-external-authority","operations":["INFORM","RECOMMEND"],"scope":"submitted-example-only","to":"9f76fe2e3ccc2260d7f3432678f3666137f55312bfbbc8d1e55ecb0b72c0401b","transform":"COPY","valid_from":1789461590,"valid_until":1789469290,"warrant":{"evidence_hashes":["67677c7a07e0c626a20cf9e891f1f64494c71ca0fc771a729e9cc26bebe8a41d"],"statement":"Exact COPY of this source for INFORM or RECOMMEND only; all qualifiers and unknowns retained."}},"protected":{"algorithm":"Ed25519","canonicalization":"WHP-JCS-I1","key_id":"d41a3d6dcab9b999577c99f19aadf47d30fdec43b68285a05d4546c08b97795b","type":"WHP-TRANSITION-WARRANT-v1"},"signature":"+QWjd1HybbTN50VIsBR4HyT593ke7hTSYVElVUM3D5YxzVN29KoCqZNivX2R75Kk6Q82Io6nVFerXl6ZXd9UDw=="}],"version":"WHP-STANDING-SUBMISSION-v1"}
